{
  "step_id": "s-0044",
  "verb": "clean.htaccess",
  "action_tier": "destructive",
  "reasoning": "obs-0055 /var/www/html/.htaccess line 42 'AddHandler application/x-httpd-php .jpg' injected per skills/webshell-families/polyshell.md. Backup written before edit.",
  "args": [
    {"key": "file", "value": "/var/www/html/.htaccess"},
    {"key": "line", "value": "42"},
    {"key": "expected_sha256", "value": "a3f5c8de90cf47d112ab3e6f891c0d23"}
  ],
  "diff": "--- a/var/www/html/.htaccess\n+++ b/var/www/html/.htaccess\n@@ -40,7 +40,5 @@\n RewriteRule ^(.*)$ index.php [L]\n </IfModule>\n \n-AddHandler application/x-httpd-php .jpg\n-\n # End of file",
  "patch": null
}
